speaker,q&a,content
Richard Carlson,1,"And then also I guess on Brabant, the back of the envelope on the contribution there I think is about $23.5 million just in 2 months. So, is this just seasonally time of the year? Or when you think about 100 million in annualized there, an assumption that you start purging some of the products there?"
Ramzi Hermiz,1,"Well, one of the things that, with Brabant, again this is a strong quarter from typically from a European side. So, there is a little bit of strength there. What we also see as this business is, I’d say a turn around and we recognize that, there was business that they were not winning. And part of the reason we, I’ll say, negotiated a very attractive price for this was they, they were going to lose some business. They didn’t get the replacement business. So, we knew that at the acquisition. We weren’t afraid of that, but it is part of that forward-looking revenue piece. 
Now what is, what we thought would happen did happen within the week of after acquiring the business. We have already won awards, business awards both on the aluminum casting side, which we were not aluminum casting in Europe. So, the fact that Shiloh’s name is hanging over the door. With the really talented team, so I got, make the comment. Let me make one comment first, the team that and the people that we acquired through this acquisition extremely talented team. We got some great engineers, great leaders, great sales team, it’s really going to help us develop our European business. What the customer base was concerned with, was the ongoing ownership of the private equity firm and what was their strategy. 
So, they, the customers were not confident and awarding business, not because of Brabant’s technology, not because of the quality of the people, but because of their ownership structure. So as soon as we change that strategic coming in, somebody focused on growth who can develop this, we’ve already seen business awards. So, we’re comfortable that while it won’t impact new revenue growth per say in Brabant and revenue next year, it does help the future. But what Brabant also bring again immediately is the rebalancing of production in Shiloh, but also for the business awards, we had previously one, we would have had to build or expand in Poland. 
Now we don’t need to do that. We’re going to leverage those Brabant facilities in essence immediately. And so that’s part of the integration activity that we’re doing right now is rebalancing our Poland facility, which was working 7 days a week. Now we’re being able to put that in that some of that available capacity instead of spending new capital. We’re able to redeploy in this case we’re used the Brabant capacity to manage that. So, when we, as I mentioned earlier, when we look at this, there was a number of strategic regions why it made sense and then back to the earlier question from John about future CapEx. We would have had to spend immediate CapEx in ’19 and again an additional ’18 for more capacity. Now we don’t need that. That’s actually part of the acquisition price, which we both potentially could be $200 million of revenue capacity for what it would cost us to build a $50 million revenue magnesium plant. So, this is really a great accelerator for future growth. "
Richard Carlson,1,"Got it. And then also first negative free cash flow quarter in a couple of years, I mean was that also pretty much driven by Brabant and then how do we think about that for full year?"
Ramzi Hermiz,1,"Full year I think we would see an overall positive number. I think this is more again back to the significant amount of activity in the quarter. We spent a fair amount of capital as we launched. We had Brabant. We had some of the integration. I would say don’t get used to seeing that, so -- or you shouldn’t have to get used to seeing that."
Richard Carlson,1,"Right. Seems like a little unexpected as you guys obviously had pretty strong free cash flow generator so just wonder as we model how to incorporate that in. And then just last modeling question, tax rate was of course a little lower than expected. How do we think about that now and then I assume some of that was driven by the Jobs Tax Act?"
Ramzi Hermiz,1,"Can you repeat that question, I am sorry?"
Richard Carlson,1,The effective tax rate for the quarter was lower than we were expecting which I assume some of that is still from working through all the US the tax reform acts but how do we think about that for the full year and actually even going forward beyond that?
Jay Potter,1,"Yes, Richard, you are exactly right, that was on continued adjustments due to the tax laws in the quarter. As we look out longer term we think we’ll land around that statutory rate right around 21.2% as we look ahead. "
Operator,1,"[Operator Instructions]. The next question is from the line of [George Casper], a private investor. Please go ahead with your question. "
Unidentified Analyst ,1,First question ask here is could you identify your new total parts launches in the first half this year and what you expect in total parts launches for this third and fourth quarters on a relative basis?
Ramzi Hermiz,1,"Are you talking about the number of parts, George?"
Unidentified Analyst ,1,"The number of parts, yes. The number of new parts."
Ramzi Hermiz,1,"Probably 50, may be a 100. I mean that’s not -- I would track it by program George because a program is, could be 20, 30, 50 part numbers in a program because of the assembly and the work we do. So, we probably have 10 large programs that we are launching currently in this quarter and which could be 100 parts. I mean it’s -- I’d be better prepared for that question next time, so don’t worry about it. And then when you look at it for the second half versus the first half, those start going into production. I would say we would expect half that amount in the second half of this year because of a lot of these are the customers’ model years where they’re going into production for 2019. So, as we get to the back half of the year, those are really already for the most part being launched."
Unidentified Analyst ,1,"And in your compression systems cost structures associated with new parts production, is obviously an upfront cost, correct? And obviously that would impact your initial start-ups of new parts production. "
Ramzi Hermiz,1,"We understand when you’re saying compression, are you talking about casting?"
Unidentified Analyst ,1,"Casting, casting, yes. "
Ramzi Hermiz,1,"So yes, when we look at it from a casting standpoint, a lot of activity on the casting front. That’s where we see that value. When I mentioned Clarksville and Nantong are both are launching new casting facilities, so that’s where one aluminum, one magnesium. So that is where you’re seeing a lot of activity. And back to your question of part numbers as well is, what you’ll also see is the value creation and one of the things in our -- for one of the programs, the prior version had 57-part numbers, we launched it, now we have 17-part numbers. It’s more the value that we are adding and it’s less about the number of part numbers. So, we still casting as a growth opportunity for us. But I don’t want anybody to walk away with the impression that steel is an opportunity. We are doing a lot of innovative things to lightweighting the steel front. With the high strength steel and some of the new alloys, Shiloh’s involvement on that front, they are -- they bring value. So, Shiloh’s multi-material approach of being able to manage in lightweight steel, aluminum and magnesium again is a clear differentiator in the marketplace. So, I know a lot of questions come about the casting side, what we’re doing in stamping and laser welding is really innovative, and we’re taking out weight there. And actually, there was, has been a question on some of the tariffs. But this, even with the higher, with the import tariffs and price of steel going up, this actually creates an additional opportunity for Shiloh, because we can take, we’re focused on gross weight as well as net weight. 
So, when a customer had a 10% increase in a door inner that’s a monolithic door with our laser welding technology. We can offset with value engineering, [value] analysis, we can offset that impact of, by taking out the gross weight. So again, I just, I kind of deviated from that just because I don’t want any, steel is not dead. Steel is going to have a part in a multi-material, multi-mix vehicle for sure. So, casting is an opportunity, for sure, magnesium structures, aluminum structures, fit as well as steel. "
Unidentified Analyst,1,"And then on China, the actual revenue generating date. Could you give us a target of when begins? And what you might expect to produce at the beginning and by late 2019? What’s your actual start date?"
Ramzi Hermiz,1,"Actual production is, we are, we’ll be, call it, September of this year will be start of production. Where we will begin a slow ramp. This is a new for what’s being launched in Nantong will be a new transmission for General Motors in that region to be doing their assembly. So, there will be a slower ramp if we would hit full volume by the end of 2019 for that transmission design. But at the same time, the team is working on some other new business opportunities and we feel very confident. As I answered on a previous question, on the growth opportunities within China. Not only for our aluminum business, but we’re there with mag already and with our Shiloh core dash panels that we’ve been there since late 2015. So, all the multiple products have opportunity."
Unidentified Analyst,1,"And then on this, the forward canceling of the F-150 production due to a production, parts production plant fire, which, I assume that, that has caused some reduced output on your part for parts for the F-150. Do you have thought on how this can get turned around in here?"
Ramzi Hermiz,1,"Well, the thermal event at the Meridian facility on May 2nd clearly was a disruption in the industry. And as somebody, who’s in the magnesium testing business, I mean, first thing, I would say is it’s great that nobody was injured in that event, because of the complexity. So that’s, first and foremost. The impact of the F-150, I mean it impacted 4 General Motors of BMW, Mercedes and FCA were all part of that facility. Overall, I would say it had a net, it will have a net neutral effect because of this reason. Yes, there was a stoppage in production and that, obviously, is impacting our, more of quarter three event for us than necessarily a quarter two. But at the same time, we were in a position to assist a few of those customers to get through their shutdown. 
So, I would say, it’s going to have a net neutral effect. What I would say, we did generate was with some of these customers, some extreme goodwill, because of our speed and ability to respond to help them get back into production or at least partial production. As you guys know, Mercedes and BMW are targeted for our Clarksville’s facility, which is a mag facility. And what Shiloh actually has is the next generation vehicle. So, what was in the other -- the Meridian plant was the old gen, we have the future products. So, we were able to, as I mentioned we’ve been accelerating our launch of the Clarksville facility. That’s in part response to make sure that we keep vehicles on the road for our customers. "
Unidentified Analyst ,1,"Okay. Thank you. And then one last one if I could. You did bring this up, this tariff situation that we are talking about now moved by President Trump. What’s the impact when you look at your Mexico operation and may be what conceivably you are going to be looking at in China? How do you -- do you see this as a neutral kind of situation or is it going to be a difficult barrier to get over?"
Ramzi Hermiz,1,"I am going to take a few minutes to answer this one George. The short answer I am going to say relatively neutral but in that it’s really you have to break it into three distinct discussions, China, Europe and NAFTA. China, we don’t import, export, really in either case. So, from the tariff debate that’s going on with China, I will say it has on the raw material a zero impact. Actually, the plus side of what’s going on and what some of the changes that China is doing is the reduction of import duties to 15% on vehicles imported into is actually has a potential to be a plus for us because most of those vehicles would be premium vehicles, which is where Shiloh participates in, in many cases from our European customers, GM, Volvo -- I am sorry, Volvo, JLR, BMW, Mercedes. So that could potentially be an upside win for us. The debate to move tariffs on EVs could be an upside win because of our North American customers as well as our European customers. So again, in our lightweighting and noise management products. 
So, the -- what’s going on in China actually has an opportunity to be a plus side. When you look at European position, you have the raw material side, I think overall while it’s creating a headwind, something over a period of time can clearly be mitigated for us. The question there will be a lot of our domestic OEM, our domestic -- the domestic facilities of our European customers who import or export their products, that could have an impact, the volume impact. So that’s where we are evaluating. It won’t have a raw material impact to us but it’s what’s their impact on the vehicle movement. 
Specific to NAFTA, part of the reason we restructured part of our restructuring plan was really moving products to Mexico or products that’s in Mexico to the US. So that activity has already started. I felt that Shiloh was extremely proactive in both setting the stage for what I will still say I am cautiously optimistic about ‘19. We are in a position with our restructuring plan to manage mix; one, to manage potential tariff disruption or the NAFTA disagreement or right now disagreement that we are in a position to do that; and three, our restructuring gives us the ability on the global scalable side. 
So, I think we can manage and we’ve put a number of actions in place starting last year that will position Shiloh in -- better than most who are still I think there’s a lot of people waiting on the sidelines to say we lacked when we know. We’ve acted with a flexible variable structure that we can accelerate or decelerate. And in my mind, we’ve actually accelerated some of our restructuring activity in part because of the mix shift and with the OEMs are obviously coming out and saying now they’re more purposely eliminating or canceling car programs, and so we’re accelerating our activity. So, we are going to be well positioned for ‘19."
Unidentified Analyst ,1,"And just in summation, it looks like the company you’ve brought it now to the point of where there is some -- could be some very, very positive acceleration and results for all the effort that has been accomplished over the last couple of years and the additional efforts that you had going now in the last 6 months to 9 months. So hopefully this will all come together as we move forward through the second half of this year. Thank you. "
Ramzi Hermiz,1,Thank you. We got a great team at Shiloh and they’re making it happen for sure. 
Operator,1,"Thank you. At this time, I’d like to turn the floor back to management for closing remarks. "
Ramzi Hermiz,1,"From my standpoint, really pleased with the progress Shiloh's making. We’re on track to our plan for 2018. As we look into 2019, I see a lot of the programs coming together, be it the restructuring, be it the acquisitions and integration, the product launches and really start seeing the 3 billion, nearly 3 billion of wins that we've had over the last 3-4 years, starting to roll into production and that’s exciting to see the teams, we got strong processes in place. It’s an exciting time, I think we’ve prepared ourselves for uncertainty. We’re taking what is considered uncertainty to try to create that as an opportunity and I think what we’re doing to position the business are the right things to do. We’ll have, if there is a downturn in ’19, we will have a smaller nimbler footprint that has a high degree of variability, in a sense of vulnerability and variability of cost structure that’s part of our restructuring efforts that again, will position us to move forward and again volumes not going to be our growth objective per se, on unit volume of vehicles. That’s not what’s going to drive our continued progress, it’s going to be that content per vehicle and that content per vehicle opportunity still remain and we’ll continue to right, remain. So, we have the right strategy at the right time, so we’re confident with that. So, thank you everyone. You have a great day and we’ll talk to you soon. Thank you. "
Operator,1,This concludes today’s conference. You may disconnect your lines at this time. Thank you for your participation. 
