speaker,q&a,content
Operator,1,[Operator Instructions] Our next question comes from the line of David Leiker with Robert W. Baird. Please proceed with your question.
David Leiker,1,"Good morning, everyone."
Donald Duda,1,"Good morning, David."
David Leiker,1,"I want to start with a comment you made about the quarterly pattern and thanks for sharing it. If – what I heard – if I heard – what I heard is correct, you’re saying your Q1 revenues are going to be the lowest revenue number for the year, is that right?"
Ronald Tsoumas,1,That’s correct. [That can jump beyond launches.]
Donald Duda,1,Right.
David Leiker,1,"Yes. Well, Q1 is going to also benefit from Grakon where…"
Ronald Tsoumas,1,"I’m sorry, David. Go ahead."
David Leiker,1,"Grakon sales, I mean, is going to be added into that number versus last year as well though?"
Ronald Tsoumas,1,"Oh, sure. Absolutely."
David Leiker,1,"Okay. Well, I cut off what you said."
Ronald Tsoumas,1,Q1 tends to be one of our slowest quarters.
David Leiker,1,"Right. Okay. That’s why I just wanted to make sure I heard that correctly. And then as we look at this – the laundry program, is this the timing of this? It’s been – it seems to be a little bit of a moving target. How confident are you that that’s going to hit when you’re thinking it’s going to start to hit?"
Donald Duda,1,"Yes, that’s a very good question, because it’s been delayed in the past. We’re starting to see a movement towards launch. There’s – here you start to see releases and meaningful footprints to the customer hitting their projected launch day, which I think is October. So that doesn’t mean, it doesn’t change. But we’re starting to see positive signs. So let’s put it that way."
David Leiker,1,"And you’re at a point right now where you’re ready to go. They just have to say, start shipping, right?"
Ronald Tsoumas,1,Absolutely.
David Leiker,1,"Okay. And then you also dropped in there on the Interface, a commentary about some of the legacy data products. You talked a little bit about what’s going on there. What’s the size of that? What’s the run off or impact of that??"
Ronald Tsoumas,1,"It’s one gig transceivers, which I’ve been under tremendous price pressure for three, four or five years, if not longer. Ultimately, that will wind down, and we’re seeing slower sales. And then we thought maybe even a year ago, 10 gig is improving, but not enough to offset the one gig product. So it’s note worthy, it’s not going to make or break the year, but it was just worthy for commentary."
David Leiker,1,Can you give us some sense of scale of how large that is for you right now?
Ronald Tsoumas,1,The two combine about $15 million in sales annually.
David Leiker,1,That one in the 10 combined?
Ronald Tsoumas,1,Yes.
David Leiker,1,Okay.
Donald Duda,1,"Variable, but it could go to $12 million or $10 million."
David Leiker,1,"Okay. And then when we look at your sensor business, how large is that today in terms of the revenue contribution for you when you take the whole portfolio of sensors?"
Ronald Tsoumas,1,$40 million. They’re going to in 2022 $80 million some – $85 million…
Donald Duda,1,Yes. And we anticipate actually will go higher to $200 million.
Ronald Tsoumas,1,Yes.
Donald Duda,1,What we said.
David Leiker,1,Okay. And then what – you didn’t make any comments about any new contract wins or anything Any color you can offer there?
Donald Duda,1,"It’s been relatively slow and we kind of anticipated that we have some very good booking early in 2019. And I don’t want to say that the automakers are in reuse mode. But that’s potentially why we’ve seen less large – or excuse me, we had bookings, but not enough that we wanted to comment on. We’d have low like this before.
One thing, I’d comment on is, our move in the lighting and our EV business has really allowed us to expand our vehicle content. I often say, we don’t really measure ourselves by what the SAR is doing. We measure by what program is done and what our content is.
I’ll give you two examples. I can’t name the customers. But if we were just looking at HMI business, we’d be in – the one customer would be in about the $60 per vehicle content. And you start to add EV and lighting to that and we’re over $122 million in book business, that’s the European customer. We got another European customer very similar going from $26 per car to $96. So our expansion in lighting and in our prominence in EVs is definitely helping us with our dollar content per vehicle, but, again, nothing to speak this quarter."
David Leiker,1,"Okay, great. That’s all. Thanks."
Donald Duda,1,"Thank you, David."
Ronald Tsoumas,1,"Thank you, David."
Operator,1,Thank you. It appears we have no further questions at this time. I would now like to turn the floor back over to Mr. Duda for closing comments.
Donald Duda,1,"Christine, thank you very much, and we’ll ask – thank everyone for participating today. Have a good day."
Operator,1,"Ladies and gentlemen, this does conclude today’s teleconference. You may disconnect your lines at this time. Thank you for your participation, and have a wonderful day."
