speaker,q&a,content
Huifeng Chang,1,"Colin, this is Huifeng. Overall, compared to 12 months ago or even 24 months ago, our balance sheet is in much, much better shape. And that's the result of almost over $2 billion worth of solar assets monetization. And then we paid off the convertible and also a $150 million loan to a Chinese bank early this year in Q1. So now talking about debt asset ratio, I think we are now in the lower 70%. However, on the cash flow side, we also doing better than probably 24 months ago, recently, we finally received the tax refund from the U.S. federal government IRS, which is a significant number. However, with that said, we have more project opportunities in the pipeline and also in the market available for us to bid. I can tell you that our teams in different regions, they compete for the limited capital we have at the corporate. They want -- everyone wanted more projects, do more business in their markets. But we have to optimize at the corporate level. And so for that, we are open to find the people in the form of either partnership or loan whatever, so that we can do more projects. The project, obviously, continue to be healthy. And then Q1 this year, 2019, is the season of drought. You guys can see the number. But for Q2, we started picking up in project sales and then Q3, Q4, we will be much higher. Now there is news out there in the market that we are selling projects in the U.S., selling projects in Japan, et cetera, et cetera. I mean, we are not confirming this news. But that's our business model. We already shifted from COD sales to NTP sales. And it seems like things are getting better and better. We are doing more projects, every major market in the world. Thank you."
Operator,1,Your next question comes from the line of Mark Strouse of JP Morgan. Your line is now open.
Mark Strouse,1,"And we'd also like to wish Shawn a speedy recovery. So most of our questions have been asked already, but I think just wanted to start about your project sales, the majority of which you said are scheduled for 2020 or later. Can you just talk about the willingness or the appetite to set to sell those on earlier in the process perhaps at NTP versus at COD? And just kind of trying to get a rough sense of what your expectations are that's bake into 2019 guidance? Thank you."
Yan Zhuang,1,"I guess, this probably -- either you are second or first participating into our earnings call. I look forward to see you in person in New York. To answer your question, let me talk about two sides, from us, the seller side and also the other side, the buyer side, and also different markets. Overall, from us, the better use of our capital still in the development stage, not to own the assets, because a lot of people in the world that their capital cost is much lower than ours. So we want to take more development opportunities instead of owning those assets with our limited capital. But also, there is another reason of cash flow management, because a lot of projects when you started construction during the project life, it eats up lots, lots of capital. And we want to avoid that and we want to get investors in earlier so that they pay for all the costs in the construction period.
And then from the buyer side, in the past, especially when we were selling the six huge projects in the U.S., they were mostly in California. And then we had a public auction. And then many of our partners, the buyers, they pay the hefty professional fees. But at the end, they didn't win the bid and then which created some kind of awkward situation. So we have been many times told by our buyers that they wish that they can move in earlier in the project stage. So that, in other way, they also can make a higher IR return on the project that is to be developed versus the COD projects. And for us, as usually even now we do NTP sales, but when we sign contracts to sell the PSA with the buyer, and at the same time we sign a module supply agreement, we sign the EPC. So we still get the benefits to run the project and to supply the modules, such as our project in Mexico, a typical example, and also another project in Argentina. So we become more and more supply our own module to our projects all around the world. It's the perfect synergy between the project business and the module business. And overall, in terms of valuation, as you can see that the 10-year U.S. Treasury interest rates actually are trending ahead and again to the downside. Now, I guess, it's about 2.2% to 2.3%. A year ago, when it was around 3%, the people were talking about may go back to 5%, obviously, if that's the case, that's a negative factor for our asset value. But now long-term interest rates keep coming down, and there are a lot of money in the world of pension funds, insurance company, even the investor banks on Wall Street such as Goldman, such as Deutsche Bank, Morgan Stanley, JPMorgan, they all have formed internal solar asset management group and they become our clients. And then the traditional energy companies such as Duke, such as AES, et cetera, they are also moving into the renewable space, and how they do that? They start first by buying solar projects. So the demand is there. I think it will be there for at least the next 5 years to 10 years. Not a problem. So in that sense, our project business, we will continue to enhance putting more investment and make the team stronger. And now we have gained a lot of more experience in the emerging markets. And we are now looking into new opportunities in the market such as South East Asia like the Philippines, Sri Lanka, Thailand, the Vietnam. But also now, we have a huge pipeline in Australia. So 2019 is really big year for another cycle of growing our projects business. We have significant projects to be delivered in 2020 and 2021. And that is published in our press release. If you have more questions, I'm coming back to New York the week after, after the SNEC Conference in Shanghai. And I will be happy to see you in the office."
Operator,1,"Thank you. [Operator Instructions] Your next question comes from the line of Alex Liu from UBS. You may now ask question. Hello Alex Liu, your line is now open [Operator Instructions] There are no further questions at this time. I would now turn the call over to the management. Thank you."
Huifeng Chang,1,"Well, we thank you for your continued support. If you have any further follow-up questions, please contact our Investor Relations. Have a great day."
Yan Zhuang,1,Have a great day. See you guys in New York.
Operator,1,"Ladies and gentlemen, that does conclude our conference for today. Thank you for participating. You may all disconnect."
