speaker,q&a,content
Ben Isaacson,1,"Thank you. And my last question is this 120,000 ton expansion, sorry to bring it up again. I think originally you had this coming on at the end of 2019. In March, I think, there was an article in Chile where you gave an interview about it coming at the end of 2020. And now the second half of 2021, are you comfortable with this date now? Is there a risk that this gets pushed back another year or two, if it's not related to market conditions or technical issues?"
Ricardo Ramos,1,"Well, first, I'm not so sure about the article in Chile. If I said 2020, if I said that probably was wrong, because 2021 is the right timing now. What I want to be very sure is that we're really full committed, as we expect to be producing at the end of the year 2021.
We think, we've sold and we take into account all the issues of the previous expansion from 48,000 to 70,000. I think was a very good idea to delay the project not because the market conditions to delay the project because we learn and we are going to have a better production facility in order to have the best quality worldwide of lithium carbonate and lithium hydroxide.
And it's going to be a better facility. And we have been reviewing the project in a daily basis. May I say now that probably from the 280,000 metric tons close to $100 million are already committed. Some of the new facilities or new equipments had already in the north of Chile, means, where a full production moving very, very fast, but trying to do it right. That's why I prefer to say that not before the end of the second half 2021, but we're really committed about these timeline, and we're really committed about having the best production facility in the world at the end of the year 2021."
Ben Isaacson,1,And just a point of clarification when you say you're really trying to make it the best facility. How do you measure that? Does that mean lower cost than where we were a year ago? Does that mean lower maintenance CapEx. What is that you're trying to achieve that perhaps you didn't in the original estimate of the phase coming on in 2019?
Ricardo Ramos,1,"The lithium business, the lithium market is changing everyday and the requirement from clients especially in the electric vehicles market are more complicated and more difficult requirements. Today it's quite used to be two or three years ago. That's why having a better facility allow you to have the flexibility to produce better quality products and to be able [indiscernible] in the past – has been in the past and will be in the future.
The best provider of lithium worldwide, it means, who will provide the best lithium, and if you request a very specific quality of lithium, we want to be ready to deliver you the lithium you need in order to produce this specific battery you want to produce, means, a better production facility, means, better deals, yes, of course, better cost, yes, but the most important one is having the flexibility and the quality to deliver the product that is needed by the different customers we have."
Ben Isaacson,1,Thank you very much. That's helpful.
Operator,1,This concludes our question-and-answer session. I would like to turn the conference back over to Gerardo Illanes for any closing remarks.
Gerardo Illanes,1,Thank you all for joining us today and we hope to have you with us in the next conference call. Goodbye everyone.
Operator,1,The conference is now concluded. Thank you for attending today's presentation. You may now disconnect.
