speaker,q&a,content
Company Participants,0,"Rob Dennis - Chairman, President and Chief Executive Officer
Mimi Vaughn - Chief Operating and Financial Officer"
Conference Call Participants,0,"Mitch Kummetz - Pivotal Research
Laurent Vasilescu - Macquarie
Jonathan Komp - Baird
Sam Poser - Susquehanna"
Operator,0,"Good day, everyone and welcome to the Genesco First Quarter Fiscal 2020 Conference Call. Just a reminder, today’s call is being recorded. Participants on the call expect to make forward-looking statements. These statements reflect the participants’ expectations as of today, but actual results could be different. Genesco refers you to this morning’s earnings release and to the company’s SEC filings, including the most recent 10-K filing for some of the factors that could cause differences from the expectations reflected in the forward-looking statements made during the call today. Participants also expect to refer to certain adjusted financial measures during the call. All non-GAAP financial measures referred to in the prepared remarks are reconciled to their GAAP counterparts in the attachments to this morning’s press release and in schedules available on the company’s homepage under Investor Relations in the Quarterly Earnings section.
I will now turn the call over to Mr. Rob Dennis, Genesco’s Chairman, President and Chief Executive Officer. Please go ahead, sir."
Rob Dennis,0,"Good morning and thank you for being with us. I am joined today by our Chief Operating and Financial Officer, Mimi Vaughn.
Let me take a moment to highlight developments with respect to our senior leadership team. On May 1, Mimi Vaughn, our CFO was appointed to the additional position of Chief Operating Officer. As you know, we are in the process of hiring a new CFO from the outside and we are in the closing stages of that process. Until that role is filled, Mimi will hold the dual titles. And the reality is that Mimi has already been bridging both roles as she has been working closely with our various operators on key initiatives, such as cost control, real estate management and performance improvement plans. This move formally recognizes her efforts and strengthens the management team as we move forward with a footwear-focused strategy. So congratulations, Mimi.
Now, following the sale of Lids in early February fiscal ‘20 is off to a good start with improved results in every business with Journeys leading the way. In our first quarter, consolidated comparable sales increased 5%, our eighth consecutive quarter of positive consolidated comparable sales for our footwear businesses. Importantly, our overall brick-and-mortar performance remained firmly in positive territory and e-commerce sales accelerated from recent levels continuing its strong multiyear run. Our overall comp result was fueled by another spectacular quarter at Journeys as the momentum from the strong back-to-school and holiday seasons carried into the New Year. Shoes comps showed improvement, turning positive in Q1 helped by easier comparisons and increased promotional activity aimed at trying to stimulate demand in what remains a challenging UK footwear and apparel market.
After a record setting year, Johnston & Murphy comps were flat as sales for spring merchandise were slow to take off with generally cooler temperatures across much of the U.S. The combination of strong consolidated comps, higher gross margins and the benefits from numerous cost savings initiatives implemented throughout fiscal ‘19 resulted in first quarter adjusted EPS of $0.33, which was well ahead of our expectations and up meaningfully from last year’s $0.14. In general, first quarter results are impacted by tax refunds. And with the changes from tax reform and the new withholding tables, there was a good amount of uncertainty about the total refunds that would be issued this year. And so we were intentionally conservative in our guidance for the Journeys business in particular as this business is significantly impacted by refunds. Lower refunds would have certainly translated into lower sales for Journeys and there were early delays due to the government shutdown, but when all was said and done, refunds were at a sufficient level in the first quarter to fuel Journeys robust comp resulting in a beat to our expectations.
Continuing with Journeys, the strength of their product assortment drove another quarter of tremendous results. This was achieved across multiple categories, in areas where cold weather persisted into spring demand for boots was strong. The same was true for sandals in warmer regions, while sale of the latest sought after retro and casual athletic styles from a diverse mix of brands were robust throughout much of the country. Both the store and e-commerce comps were nicely positive which led to a 7% increase on top of last year’s 6% gain and a significant improvement in year-over-year profitability and great expense control, along with strong sales allowed for expense leverage across multiple line items, including rent, selling salaries and marketing spend. Results from our new workforce management system rolled out this year are especially worth calling out. Journeys increased its pay per hour, reduced hours and spent almost a $1 million more in-store labor, but leveraged this expense by achieving higher conversion and better labor productivity by putting hours in the right spots in the workweek.
On the other side of the Atlantic, the operating environment remains much more challenging. The prolonged uncertainty around Brexit continues to depress consumer sentiment, which has caused customers to reduce purchases of apparel and footwear and instead focus their spending on basics and must-have items. The net effect is consumer price sensitivity and a bargain hunting attitude toward anything beyond those must-have items. Against this backdrop, Schuh posted a 2% comp gain, its first positive comp in several quarters. On top of lapping last year’s mid-teens decline, the introduction of a mid-season spring sale gave this performance an added boost. While a portion of our top line result came at the cost of gross margin, rigorous expense management helped from foreign exchange and property tax concessions allowed Schuh to beat last year’s bottom line. Clearly, there is still much work ahead to improve the profitability of this business after last year’s disappointing results. As we outlined on our last call, we have implemented an aggressive 20 point program taking action to address immediate near-term profitability, while executing more medium-term initiatives to enhance Schuh’s positioning with the consumer and with the brands it sells. Mimi will provide an update on this program later in the call.
Meanwhile, Johnston & Murphy posted a flat comp on top of last year’s high single-digit gain. J&M is now recognized as a casual lifestyle brand and has driven its success with a compelling offering of footwear and apparel for men and women. Following a solid start to the year, sales trends slowed midway through the quarter due to the later Easter before picking up back in April. A shift in timing of a catalog drop out of the first quarter and into the second also affected results. Overall, sales were softer than expected as unseasonable weather in much of the U.S. stifled demand for spring merchandise. Even with a flat comp, profitability was up nicely. Thanks to improved gross margins and good expense control.
Finally, Licensed Brands delivered a better bottom line performance on lower sales in Q1 as the business benefited from fewer markdowns and less closeouts this year. It’s worth noting we generated over $200 million of operating cash flow last year and we added significantly to that cash position with the sale of the Lids business. Consistent with our practice of not sitting on cash, we have been actively buying back stock and returning capital to shareholders. Across two repurchase authorizations implemented in recent months, we began buybacks in December and as of last Friday, have repurchased over 3 million shares for a total of approximately $150 million, which represents a 17% reduction to average shares outstanding last year.
We are very pleased with our start to the year. In addition to the strong Q1 results, we sold the Lids business, allowing us to turn our attention to being a footwear-focused company both operating footwear retail businesses and owning our licensing brands. Based on our better-than-expected Q1 performance, coupled with the repurchase of more shares than originally planned, we now view the higher end of our initial EPS range of $3.35 to $3.75 as our likely outcome for the year compared with our previous view of something close to the middle.
Overall, comps continue to be positive in May and have strengthened through the course of the month. Journeys, once again is leading the way, even with meaningfully higher stack comparisons for the last couple of years in Q2. Comps for J&M and Schuh are more lackluster than we would like them to be in this low volume month that begins the second quarter. The year-to-date performances of these two businesses, plus the potential for more stranded cost this year related to selling Lids, makes us now a little more conservative about the outlook for the remainder of the year. We are also mindful of the looming possibility of tariff increases on additional Chinese imports and no visibility into the resolution of Brexit in the UK anytime soon. For these reasons, we decided to hold our current range versus increasing it despite our favorable beginning to fiscal ‘20.
Before Mimi goes over the financials and guidance in greater detail, I would like to share our thoughts on the potential for tariff increases if footwear imported from China is in the proposed fourth tranche aimed at the balance of Chinese imports and how this would directly and indirectly impact our business. In terms of direct exposure, we develop and directly source merchandise for Johnston & Murphy and Licensed Brands, which together accounted for a little less than 20% of total sales in fiscal ‘19. Of those goods, approximately 50% come from China with a heavier weighting to Licensed Brands. Therefore, our direct sourcing from China is only for merchandise, representing less than 10% of total sales. The balance of our merchandise is imported by our third-party vendors. With respect to the Journeys business, which accounted for 65% of total sales last year, we estimate that approximately 30% to 40% of the product we buy from third-party vendors is sourced from China. The remainder of our business, which is based in the UK and the Republic of Ireland, would not be affected. So in total, only about a third of our merchandise potentially would be affected in some way by these tariffs.
So with this next round of proposed tariff schedules for a public hearing in mid-June followed by a public comment period, this is an evolving situation. It is important to know however we have not incorporated the impact of increased tariffs into our guidance for fiscal ‘20. While we are hopeful for a successful resolution of these trade negotiations with China, in the event tariffs are implemented with respect to our direct sourcing, we would work with our supply chains and look to exercise a variety of options to mitigate the effect. These options include moving production out of China and into other countries, working with our vendors, agents and factories to absorb a portion of these additional tariffs, and looking for further efficiencies in the supply chain. We would expect our third-party vendors to undertake similar actions and obviously currency movements could further mitigate the impact. So with all the moving parts and pieces, it’s too early to quantify the full impact, which under any circumstances won’t be a factor until the back part of the year. And in the meantime, we are pulling forward fall products for earlier receipt and expediting delivery in advance of tariff rulings wherever we are able.
And so with that, let me turn the call over to Mimi to give more specifics on the financials and our guidance."
