speaker,q&a,content
Riccardo Delle Coste,1,"Sure. Thanks, Ray. So the number that we believe that a 400 school target number, we should be able to get there before the end of the year. So we’re pretty comfortable with that number by December. But the most interesting part of that is, let's just say the existing 300 schools that we have now because that's a number that we actually have confirmed. That's actually 300 schools that we actually have pouring our product. But what is not so evident is that those 300 schools are actually part of a much larger district. So for example and the reason why this is really important is because typically the most challenging part of this business in the school channel is actually getting approval. 
Once you're approved in a particular district, school district, then it's a lot easier for them to say, okay, we're in two schools, we're going now add you to three other schools or 5 other schools. So that's really the most challenging part. So coming back to the 300 schools that we’re already in, the part that’s not so evident is that those schools represent probably a much greater number of schools that are part of their district that are probably closer to 3000 to 4000 schools. So we feel that there's going to be a natural organic growth in addition to getting new schools. 
Now, are we going to get all of them? No. But it's an organic growth opportunity that exists within the customers that we've already sold product to. So as we keep going down the path, we think that there's an enormous opportunity to keep growing and a perfect example is Pasco County. We started within that district in 30 schools, we’re now in 50. So that's the type of organic growth that we can expect within the existing channels and that's without the new sales process. It's probably worth mentioning that we have a lot of schools that we have 3 schools or 5 schools in a particular district and that district represents 100 schools or 200 schools and some even greater than that. 
So when you take that away and have a look at the ground work that we've done and the selling cycle as well, right, schools have lot of vacation times and there's certain bidding times. So there is a little -- there's been a little bit of learning from our side in terms of the timing for acquiring these accounts, but I’ll tell you it's incredibly exciting for us to be in this channel and we really see it as an enormous growth channel for us that will eventually be very consistent and repeatable revenues. So very excited."
Unidentified Analyst,1,"And then what do you think we could expect on a per school basis, how much revenue can an individual school generate."
Riccardo Delle Coste,1,"Probably about 10,000 to 15,000 annually per school."
Operator,1,Our next question comes from the line of [indiscernible]
Unidentified Analyst,1,"You’ve been talking a bit more about the military opportunity, specifically, how many bases you expect by the end of the year and what kind of revenue you expect per installation?"
Riccardo Delle Coste,1,"Sure. So we announced the 45 installations earlier in the year or not too long ago actually. So they are all pouring now. They did -- we did get delayed a little bit. We expected those to be all installed by the end of September. Unfortunately, we did have some delays on the equipment side in terms of getting equipment delivered because we have taken a lot of supply from our supplier, so they got done, majority of those got done in October and that was really -- there's been a delay in the revenue recognition into this quarter as a result of that. But in terms of where we expect to finish the year, we think a number of 70 to 85 is probably close to where we'll finish the year. So, a significant leg up again still from where we currently are. So that's where we expect to finish the year with the military locations and we will provide a more accurate and detailed update on that very shortly."
Unidentified Analyst,1,And what kind of revenue do you expect per installation?
Riccardo Delle Coste,1,"Yeah. Look, we're expecting anywhere from 35,000 to 50,000 per installations. So these are high revenue locations. So that's what we're expecting on a per location basis."
Unidentified Analyst,1,Is that per quarter or per year?
Riccardo Delle Coste,1,That’s per annum.
Operator,1,"Ladies and gentlemen, we have reached the end of the question-and-answer session and I would like to turn the call back to management for closing remarks."
Riccardo Delle Coste,1,"Yeah. Thanks, everybody. Obviously, a very exciting time at Barfresh and we look forward to actually bringing some more developments shortly and thanks very much for joining. Cheers."
Operator,1,This concludes today's conference. You may disconnect your lines at this time. Thank you for your participation.
