speaker,q&a,content
Sam Reid,1,"Awesome. Thanks, guys. And then if I could just sneak one more in here just on retailer inventories. Broadly speaking kind of where would you say inventories are at retail today across your business? And are there any pockets where you think there might be some more rationalization in 2019? Thanks so much."
Douglas Martin,1,"Well, we think there’s a never-ending path from a retailer’s perspective to make their inventory positions as efficient as possible. But we think most of that is behind us. We did see a little bit of it in the quarter, but much less so than we had in the previous 18 months. So I’d say we’re at a relatively stable position."
Sam Reid,1,Got you. Thanks.
Operator,1,Your next question comes from the line of Carla Casella with JPMorgan. Please go ahead.
Carla Casella,1,Hi. Thank you for giving additional color on the EBITDA of the appliances. But can you give us a sense for what revenue was for the year and then how we should think about gross margin profile going forward given that you got rid of auto but are adding back appliances in?
Douglas Martin,1,"Sure. I can give you – well, we’ve given you the EBITDA and the net sales was about $1.1 billion on that business. So you can do the quick math on the margin across there. And the Global Auto Care one is out there as well."
Carla Casella,1,"Is that on the gross margin, I’m just wondering do --?"
Douglas Martin,1,"Sorry, not on the gross margin. That’s not something that we generally talk about across our businesses. I will tell you the Appliance business is a little bit lower than the Global Auto Care businesses, but healthy relative to the total portfolio."
Carla Casella,1,"Okay, great. And then have you said which debt you would target to pay down? I’m assuming you would take out the most expensive bond, the one that’s callable currently. But any more color there?"
David Maura,1,"Look, I don’t want to commit to anything. Let’s get the proceeds in. But I would tell you that yes, we have a large amount, 890 million I believe of HRG seven and three-quarter notes that we inherited with the collapse of the structure. I don’t like that piece of paper. Also for financial flexibility going forward, I would like to look at the term loan and see if we can get rid of senior secured bank debt. But I’m not committing to anything at this time. When we get the proceeds in, we’ll look at it. But hopefully, we’re just months away from a materially multi-billion-dollar debt pay down and I’m excited to get to that point."
Carla Casella,1,"We are too. Can I just ask one more on Sears? Any specifics on impact from the Sears bankruptcy and if there’s a greater impact, does the company end up liquidating versus continuing as a growing concern?"
Douglas Martin,1,"No. We have a very modest write-off in the first fiscal quarter related to Sears and Kmart, less than $0.5 million. We changed terms early in the year for virtually all of our businesses there."
Carla Casella,1,Great. Thank you.
David Prichard,1,"Okay. Operator, we’re near the top of the hour. I think we have one more question. Why don’t we take that? And that will exhaust all questions. And we’ll close down the call."
Operator,1,Certainly. Your final question comes from the line of William Reuter with Bank of America. Please go ahead.
William Reuter,1,"Hi. I just have one question a little bit related to the operations. In the second quarter, you had had some challenges in Kansas and Dayton. And then it sounded like a lot of those had been improved into the third quarter. I guess maybe you can talk a little bit about what happened between the third and fourth quarter that reverted some of the challenges?"
David Maura,1,"I think we hit that. The DCs continued to improve. But we had weather hurt us on Home & Garden side. Pet, we had issues in the DC in Europe. On the GAC piece, which is now sold, that was 18 million of the delta and that’s really related mostly to just inventory cleanup to get that balance sheet healthy for E&R and also reserves. And we took reserves across the rest of the portfolio as well. Look, in general, I’m going to run this company much more conservatively from both a P&L and a balance sheet standpoint and that’s the reality."
William Reuter,1,"Okay. And then just one follow up. It sounds like the tariffs are going to impact you. However, you have pushed through a lot of price increases to offset these, however, not fully offset them it sounds like. In the event that the tariffs are repealed, have you had conversations about what would happen to pricing? Meaning would you be pushing through less price increases or a smaller amount than you’ve been talking to at this point?"
David Maura,1,"That’s a good assumption. I hope you’re right. Your lips to God’s ears on them getting repealed. But look, we want to get through it first. And we have priced for tariffs. What we’re trying to communicate is, look, if the waters remain choppy on tariffs, we’ll be passing them through. But we’re only passing them through dollar for dollar. And obviously that continues to constrain margin."
William Reuter,1,Makes sense. Okay. Thank you.
David Prichard,1,"Thank you. With that, we have reached the top of the hour. So we will conclude our conference call. I certainly want to thank both David and Doug. And on behalf of all of us here at Spectrum Brands, thank you for participating in our fiscal 2018 fourth quarter and full year earnings call. Have a good day."
Operator,1,This concludes today’s conference call. You may now disconnect.
