speaker,q&a,content
Frank Saxon,1,"Yeah, I think, well, I would say for sure, the Haiti operation is something that we are really thrilled about. We feel better and better every day about that strategy. We've got quite a bit of time under our belt now, we're making a lot of items there. Staff has been trained very well, it really has a lot more room, we can move it up. We do have additional space where we can continue to grow that as needed. And I do agree with you. I mean, it's been on both sides of the business, that's been tumultuous to say the least, and sort of figuring out how and where production and manufacturing may settle out. 
So Haiti seems to be one that's in favor, because it's close to the US, gives us a different speed to market, is protected by the HOPE Act, which so far, not to say that anywhere safe, doesn't seem like these days to be producing outside the country with what could happen, but with the HOPE Act that's extended for a lot more years and working to be extended further, we feel like Haiti is a place that is going to offer some reduced duty or duty free advantages for a long time. So as we get more customers accepting that, we feel like it's definitely a place where we will continue to grow and we’ll be able to attract more customers there."
Operator,1,[Operator Instructions] We’ll now take our next question from John Baugh of Stifel.
John Baugh,1,"Let's start, we've seen a fairly significant shift, in our opinion, the [indiscernible] kind of share shift, if you will, versus what's going on at SSB and we know [indiscernible], is that something that you're seeing and still a challenge? Or you can overcome all that with the duties now out and some of the tailwind you expect there?"
Frank Saxon,1,"Yeah, John, I don't want to talk too much about specific customer, we would be really careful about that. Because I don't know strategies they have, but for sure, I mean, those companies, [indiscernible] make up a big share of the market. Very important customer stuff and ones that we focus on first. I mean, these are ones that we have to do a good job with. But the market is certainly more fragmented. And we're looking at other places where we can grow our sales as well, because we just need to. It's just not as, it's not as dominated by a few manufacturers, it doesn't seem to me as it was before, how that market share has traded between them, I'm not fully clear on that, we just do our best to try to be important to both."
John Baugh,1,"And then I know you don't want to speak customer specifics and this is just more, just an example. But the [indiscernible] kind of bedding manufacturers domestically, are you seeing any improvement with those types of customers. You mentioned that you are finally seeing the light at the end of the tunnel, or is that just a sort of an elsewhere comment?"
Frank Saxon,1,"No. I think when we say we see improvement, we really see it across the whole chain. And we try to make it clear in the comments. For us, one of the biggest growth potential is within our cut and sew business, because we see more beds going opaque. But that's happening both with new customers that you know of and it's also happening with traditional customers. So really from high to low, we're seeing improvement across the whole chain. It’s not distinguished to one or the other and we're seeing some lift at all areas of the market."
John Baugh,1,"And then, you talked a little bit about CLASS, it sounds like it’s still growing. Just kind of curious what you're seeing there in terms of – are you attracting new customers, is it mostly you’re growing with existing customers, give us an update on Haiti and sort of where that facility is in terms of ramp up, et cetera."
Frank Saxon,1,"Yeah, it really -- the growth really is for bed and the box and for our cut and sew business, really across both channels. We are having really good success. Our customers, traditional customers are really smart and some of the things they're doing to react to new market demand is impressive. And we're having some good wins there. And I feel like if we collaborate with them, we can do pretty special things from fabric to finished cover that really helps them drive their strategies also, which is great. And that's really from low to mid to even high end in some cases. Haiti is definitely a place that we want to continue driving customers to, because we think it's a safe place for the long term from a duty rate. 
We're already, we don’t want to get too much, that facility is doing well, we're upwards of 10,000 covers a week there and with potential do a lot more. So we're really excited about that platform. I would tell you, today, we're also still currently really excited oddly enough about our cut and sew business in China. We're having great success there with cut and sew covers. Those, so far, have not been affected by section 301 tariff, they're on a pending list for. So today, that's a really good platform for us, one that's well seasoned and high volume, but something that we could also be prepared to move towards Haiti if we ever had to."
John Baugh,1,"Okay. And my last question, quickly as I think you mentioned bed and the box as still, you’re seeing nice growth there. One of the leading manufacturer’s CEO seemed to think that growth currently was non-existent, although he admitted he couldn't prove it statistically. Do you see any slowing with those customers there or is that still a significant tailwind for you or you’re just gaining share with those customers?"
Frank Saxon,1,"Well, you're speaking to the traditional bed and the box disruptors I guess and I don't know about that. I do think from a Culp standpoint, were likely gaining some share as we talk about supply chains being altered in some of the big cases, they're looking for different opportunities other than fully Chinese made mattresses. So that has been something we may be picking up, somewhat greater rate than the markets picking up. I also think we may have some coverage there because the traditional mattress companies are also doing more bed and the box types products. So, we're seeing growth in that segment of business really across the whole chain."
Operator,1,We do have another caller with questions. We have Marco Rodriguez from Stonegate.
Marco Rodriguez,1,"Good morning. Thank you for taking my questions. So wondering if you could talk a little bit more on the mattress fabrics side, just kind of based on your discussions with your customers, your clients, how are you guys thinking about the excess inventory that’s in the channel, are we talking weeks, months, any sort of color around that?"
Frank Saxon,1,"Yeah, that's a really good question and something we've talked a lot about, Marco internally. [indiscernible] measure, we track every month like a lot of people do, sort of the imports monthly and they've come down from a high of over 650,000 mattresses in a month to the, two months ago, it was 242 to last month, that was 125,000 mattresses. So, a lot of inventory is -- a lot less was coming in. We don't -- what we don't know, I don't think our customers have a lot of inventory like we actually feel some pushed and a little bit of preparation for building back some inventory, but I don't know what's on the major marketplaces, how many containers the mattresses might be on 3pl warehouses, and somewhere, they’re just sold online. So it's hard for us to get a gauge on that. I don't think it's months, in terms of several months, but it could be a couple of months more, but that's purely conjecture on my side."
Marco Rodriguez,1,"And in your prepared remarks, on the mattress fabrics side, you talked about rationalizing manufacturing operations, just wondering if you could maybe provide a little more detail in terms of what are the specific actions you've done here recently for that."
Frank Saxon,1,"Yeah, a lot of things. I mean, when that rationalization comment covers a lot of work we've done in the last really two years. Part of it is, we did and we’ve talked a lot, almost too much in a lot of press releases going back about all the capital investment we did in our mattress fabric facilities, right sizing, and then also expanding and moving and shifting. So we spent $15 million, give or take, to build that platform better in the face of looking back, it wasn't really the ideal time to do that financially. But we're so proud to have got that behind us and it will provide a lot of benefits, as we move ahead. 
Also, rationalization characterizes one thing we did was relocate certain parts of our manufacturing into more advantageous locations. One example of that is, we consolidated our weaving location into our Canada platform, which may seem minor. But when you factor in the advantages we have in Canada, bringing in raw materials and yarns, duty free into Canada, and then allowing those to come into the US as finished woven products under a TPL or a tariff preference level type of thing, we have a significant cost advantage in Canada for weaving as opposed to what we had in the US. 
So, that's the kind of thing we talk about in rationalization and we're doing that across all product categories to get the right things in the right places, balancing speed to market, which is very critical along with price, which is equally or more critical trying to figure those things out. And then without being said again, Haiti is a big part of that rationalization too, thinking about where we’ll put cut and sew. So, we're just constantly trying to stay, you’d hear for, it’s an upholstery question or mattress, but we're just trying to stay nimble, where we can move, try to adjust our production to be quick service and advantageous from a price standpoint, because that's what we think our customers demand us to do."
Marco Rodriguez,1,"And then kind of shifting gears here to Upholstery. Can you talk a little bit more about Read Windows? I believe I heard you guys had about $11 million in revenues here in fiscal ‘19. If I'm not mistaken when you guys acquired it, I thought you had disclosed that they had done prior to about 11 million or so in revenues? Can you just kind of give us an update as far as how that business is kind of moving and your expectations going forward?"
Boyd Chumbley,1,"Yes, Marco, and this is Boyd. Good morning. Yes, we are very pleased with how the Read Window acquisition has gone for us. We, you're correct that [indiscernible] and this really was somewhat of a transition year, as we absorb this business into Culp and the Upholstery Fabrics business, but we are pleased with the positive contribution that we’ve made for our Upholstery Fabrics business at year ‘19. And we certainly remain very optimistic with the enhanced platform or product portfolio that we now have by bringing window treatments into our offering in the hospitality segment. So we're very pleased with the results thus far, we do think there's a lot of opportunity remaining and yet to come, as we continue to focus in this area, but very pleased with the performance and the acquisition of that product category to date."
Marco Rodriguez,1,"And then last quick question, just talk a little bit more about your capital allocation priorities going into fiscal ‘20. And if you can also talk maybe and update us on the M&A landscape?"
Ken Bowling,1,"Yeah, Marco, this is Ken. We really value the, in our capital allocation strategy, that's what we put on the website. I mean, we've committed this year to continue to invest in CapEx, although at a lower rate. We did -- it was a really perfect timing in that, we had significant lower CapEx spending this year, but it was more -- pretty much planned that way. So that certainly helped in our free cash flow position. I think if we look ahead, the same thing, we're going to continue to invest in the business through capital expenditures, which we said, about 6.5 million, 7 million. We're also going to continue to be on the look for the strategic acquisitions and to evaluate that and look at the timing and such that it fits with the other two acquisitions. 
So that's still in our strategy. Of course, what we've tried to do along this whole time is to maintain a strong balance sheet, so that we could take advantage of those opportunities, and we feel that we are there. So that won’t change. We’ll continue to review the landscape and look for opportunities. And then of course, if that doesn't, if we need to -- if we don't have an opportunity, we’ll continue to generate free cash flow and maybe from time to time, look at our share repurchase program and look at that opportunity. And then depending on the economy and all the uncertainty, just continue to maintain the warchest of cash for basically making sure that we can sustain or withstand any pressure. So really no change in our strategy, just continue to look for opportunities and most of all, keep the company strong and keep -- just keep prepared for the opportunities as they come along."
Operator,1,[Operator Instructions] It does not appear we have any further questions at this time. So I would like to turn the conference back over to the speakers. Thank you.
Frank Saxon,1,"Okay, thank you everyone for your participation today and your interest in Culp. We look forward to updating you on our progress next quarter. Have a great day."
Operator,1,This concludes today's call. Thank you for your participation. You may now disconnect.
