speaker,q&a,content
Andrew Liesch,1,"Bryan, just looking at the securities portfolio grew a little bit here this quarter. Just kind of curios on your thoughts there. Was that just in response to the trend in loan balances in the quarter? And if loan growth is a little bit slower, should we expect to see securities grow?"
Bryan McKeag,1,"Yes. I think as we've kind of grown deposits and loans have kind of flattened, we don't have a lot of debt to pay off. So we've been investing that, trying to keep the duration sort so we get some flexibility. But -- so depending upon loan growth and deposit growth, you'll see that move around a little bit.
But we're not intending to do any leverage or do any sort of thing where we're really increasing the investment book right now. But we're also looking to put our money to work when we have it."
Andrew Liesch,1,"Okay. That's helpful. Then just on the mortgage banking, the gain on sale. Just kind of curious what your trends are there? I guess the legacy franchise, it sounds like the folks in Texas had another solid quarter.
But just curious what you're seeing here in your legacy footprint, is this part of -- is this origination numbers here this quarter kind of what you expected? This gain on sale what you expected, just kind of your trends on that business?"
Bryan McKeag,1,"Yes. I think we have a lot going on in that business as we've been working on our legacy side. And you're right, the PrimeWest group had a very good quarter. I think normal seasonal declines. If you look back, you'd see probably somewhere between 20% decrease in our gain on sale from the third quarter to the fourth quarter.
You could definitely see that again given that we're still working on our own mortgage side, and just the normal seasonal decline will hit with PrimeWest as well as our side. So..."
Bruce Lee,1,"And Andrew, as we mentioned last quarter, we outsourced our back-office and we did see a decrease in our originations in our legacy portfolio, which we did anticipate. We're continuing to sort of right size and work on that legacy operations. But PrimeWest had a really outstanding quarter."
Andrew Liesch,1,"Right. Yeah, something [ph] look like it. Thanks for taking my questions. Thanks so much."
Bruce Lee,1,"Thanks, Andrew."
Operator,1,[Operator Instructions] Our next question comes from the line of Damon DelMonte from KBW. Please proceed with your question.
Damon DelMonte,1,"Good afternoon, guys. How are you going today."
Bruce Lee,1,"Good, Damon."
Damon DelMonte,1,"Great. So just a little clarification. Bryan, on the expenses, I think you said there's about $1.7 million that were related to M&A and systems. Just from a remodeling standpoint, where could we extract those from in the line items?"
Bryan McKeag,1,"They hit -- I'm trying to solve in my head. I think they hit in other expenses, I mentioned. There was some travel. There's some in the professional line item as well. I don't think there was much up in the personnel this time. I think most of that was prior quart -- so it's mostly in those two areas would be, in the professional fees and in the -- down in the other area, I think."
Damon DelMonte,1,"Okay. Got it. Great. And then what's then the kind of the take from your Midwestern client on the impact of the tariffs, particularly in the ag lending portfolio? Are there any kind of quantifiable impacts that they're seeing or that they are expecting to see?"
Andrew Townsend,1,"This is Drew, Damon. Interestingly, we had the credit personnel at roundtables in the last week. I think the one area particularly is the soybean area. I think there is a lot of pressure on the farmers in that space. And overall, the combination of commodity prices where they are at, there will be continued stress. I would just want to reiterate, I think the general consensus -- and this was industry-wide as well as land prices are holding relatively steady, which they have.
We've positioned ourselves well I believe, even on those clients that are experiencing stress from a backside or a collateral base protection. So it does sound the outlook though is going to be a challenge for a period of time. But I think our clients are positioned well as far as the bank is concerned. I don't feel a lot of risk from a loss standpoint."
Bryan McKeag,1,"Damon, some of the pain from low commodity prices is being offset by extremely high yields in the Midwest. So both corn and bean yields are very, very strong. There's a little concern that with the wet fall that we won't going to get the crops out. But those crops are being taken out. And they got excellent yields. There is a little bit of a concern on pork prices, depending on what happens with the tariffs and China."
Bruce Lee,1,"And also a little bit in dairy because of the powdered milk that we sell to China. But overall, we're hearing it in ag but not so much at least in our customer base. Particularly in the Midwest, the manufacturers are not talking about tariffs."
Bryan McKeag,1,"Yes. What we've done in the ag area, Damon, is we've kept the leverage really, really low on our ag credits. And it seems like land prices are holding up now. I don't know how long they'll hold up.
But we try to keep the debt for a productive acre down around that 4,000 an acre level. And we still see a good productive land selling for 8 to 10. So if commodity prices remain low, we'll see that come down, but we've got a lot of cushion."
Damon DelMonte,1,Got it. Okay. That’s all I had. Thank you.
Operator,1,Our next question comes from the line of Terry McEvoy from Stephens. Please proceed with your question.
Terry McEvoy,1,Good evening. Thanks for taking my questions.
Bruce Lee,1,"Hi, Terry."
Terry McEvoy,1,"Bryan, thanks for all the help on the financial outlook. Maybe if I could ask a question on the branch sale and just the overall strategy there. How are you thinking about additional sales and what type of impact, may be per branch you expect on the expense line as we move forward?"
Bryan McKeag,1,"Yes. So I think, what you're going to see is some pruning of our branches. It's opportunistic. It's where we may have a branch that is attractive to somebody else that may be is a little bit distant from our main core markets, which was a little bit of a case in Wisconsin. They were on the -- they were north of Milwaukee.
And I think in terms of the costs, it really depends on the branches. And I think you'll see some positive on the efficiency ratio. But remember, we're also selling loans and deposits. So there is some revenue give up as well."
Bruce Lee,1,"I'd say, Terry, as far as branch locations that have a small deposit base and have very, very low opportunities for growth at the kind of multiples we're seeing on deposits, it just makes sense to let some of those go where the other can continue to grow our EPS, we got to be able to grow our earnings base. And if we've got small branches that don't offer much in the way of growth, it just makes some sense to prune some of those with the kind of deposit premiums we're seeing."
Bryan McKeag,1,And our liquidity position allows us to be able to do that and still be really well positioned.
Terry McEvoy,1,"Thank you. And then just as a follow-up. You mentioned earlier you -- and coming in second or you came in second on a number of M&A transactions. And you'd still like to get something announced this year. So my guess is that question of pricing?
And maybe just remind us your level of kind of acceptance around TDD [ph] dilution and earn back and some of the financial hurdles you're targeting as you hopefully get something across the finish line this year?"
Lynn Fuller,1,"Yes, it's a great question, Terry. We've remained very disciplined to 3 primary financial metrics. First and foremost, it has to be accretive to our current shareholders earnings per share. And it needs to give us at minimum of a 15% IRR, based on the conservative estimates.
And I think that's where we're getting beat. I think some of the competitors out there that are aggressive buyers are still projecting probably larger growth, bigger cost takeouts and other things that we would be much more conservative in our projections.
And then last, we need an earn-back in less than 4 years. But the pipeline is still deep. So we've got plenty of opportunities. And I think at this point in the cycle, there will be some banks disappointed that are very aggressive on their assumptions."
Terry McEvoy,1,"Great. Thanks a lot. Have a good night, guys."
Bruce Lee,1,"Thank you, Terry."
Operator,1,Our next question comes from the line of Daniel Cardenas from Raymond James. Please proceed with your question.
Daniel Cardenas,1,"Good afternoon, guys."
Bruce Lee,1,"Hi, Dan."
Daniel Cardenas,1,Just one quick question. Most of my others have been asked and answered. But just maybe some color in terms of the reasoning behind the drop in net income at Morrill & Janes this quarter?
Bruce Lee,1,"Yes, it was - we had a couple of credit challenges there. That's why we had the drop."
Daniel Cardenas,1,"Everything else is being asked. Thanks, guys."
Operator,1,"Ladies and gentlemen, this does conclude today's question-and-answer session. And I would like to turn the call back to Lynn Fuller for closing remarks."
Lynn Fuller,1,"Thanks, Dana. In closing, I'd like to summarize six key points. First and foremost, our assets are at $11 billion. And we're confident we're headed for $12 billion in assets next year. 2018, we will be posting another record year of earnings. We have a very attractive deposit mix with 36% in noninterest deposits and 88% in non-time deposits, which leads to an enviable net interest margin of 4.38%.
Our balance sheet is very liquid with loan-to-deposit ratio of 77%, and very little in the way of noncore funding. And finally, we have a deep pipeline of acquisition prospects, albeit, a competitive market for M&A. And as a result, we believe our company is well positioned for continued profitable growth.
So with that, I'd like to thank everyone for joining us today and hope you can join us again for our next quarterly conference call, which will be on Monday, January 28, 2019. So have a good evening, everyone."
Operator,1,This concludes today's teleconference. You may disconnect your lines at this time. Thank you for your participation.
