speaker,q&a,content
Operator,0,"Greetings, and welcome to Heartland Financial USA, Inc. Third Quarter 2018 Conference Call. This afternoon, Heartland distributed its third quarter press release, and hopefully, you've had a chance to review the results. If there is anyone on this call who did not receive a copy, you may access it on Heartland's website at htlf.com. With us today from management are: Lynn Fuller, Executive Operating Chairman; Bruce Lee, President and CEO; and Bryan McKeag, Executive Vice President and Chief Financial Officer. Management will provide a brief summary of the quarter, and then we will open up the call to your questions.
Before we begin the presentation, I would like to remind everyone that some of the information management will be providing today falls under the guidelines of forward-looking statements as defined by the Securities and Exchange Commission. As part of these guidelines, I must point out that any statements made during this presentation concerning the company's hopes, beliefs, expectations and predictions of the future are forward-looking statements, and actual results could differ materially from those projected. Additional information on these factors is included from time to time in the company's 10-K and 10-Q filings, which may be obtained on the company's website or the SEC's website. [Operator Instructions] As a reminder, this conference is being recorded.
At this time, I will now turn the call over to Mr. Lynn Fuller at Heartland. Please go ahead, sir."
Lynn Fuller,0,"Thank you, Dana, and good afternoon. We appreciate everyone joining us this afternoon to discuss Heartland's performance as we reach new heights in the third quarter of 2018.
For the next few minutes, I'll touch on the highlights for the quarter. I'll then turn the call over to Heartland's President and CEO, Bruce Lee, who will cover progress on our key operating strategies. Then Bryan McKeag, our EVP and Chief Financial Officer, will provide additional color on Heartland's quarterly financial results.
Now on to Heartland's financial highlights for the third quarter and year-to-date. Heartland reported another excellent quarter with net income available to common stockholders of $33.7 million. That's a 56% increase over the same quarter last year and $0.97 per diluted common share, a 35% increase over the same quarter last year.
Our strong performance was driven by a strong net interest margin with a fully taxable equivalent basis of 4.38%, continued improvement in our efficiency ratio at 62.4% and very accretive acquisitions.
Assets ended the quarter at $11.3 billion, and we believe we are still on track to be at $12 billion in assets next year, through a combination of both organic and acquired growth.
Return on average assets for the quarter and year-to-date was 1.18% and 1.07%, respectively. Return on average common equity for the quarter and year-to-date was 10.58% and 9.95%, respectively. And return on average tangible common equity also continues to trend positive for the quarter and year-to-date at 16.3% and 14.71%, respectively.
Well, thanks to our excellent deposit mix with non-time deposits at 88% of total deposits, our fully tax-equivalent net interest margin was up for both the quarter and year-to-date at 4.38% and 4.32%, respectively.
Our tangible common equity ratio ended the quarter at 7.7% as we work toward our goal of 8% plus. Our regulatory capital ratios are very strong, as in addition to our common equity, we have just over $200 million of parent company TruPS [ph] in sub debt, currently fixed at a very attractive after-tax rate of 3.86% with maturities laddered over the next 3 to 5 years. This is a very effective low-cost capital compared to our common equity at over 10% and additionally, in a period where interest rates are on the rise.
Additionally, our balance sheet is extremely liquid with very little in non-core funding, a loan-to-deposit ratio of 77% and an investment-to-asset ratio of 22%. As a result, I feel we are very well positioned for whatever lies ahead.
Book value increased over the same quarter a year ago to $37.14, with tangible book value increasing over the same quarter a year ago to $24.33. Clearly, we're all disappointed with the recent decline in the banking sector stock prices. With that said, over a 1 year period ending last Friday, October 26, Heartland's stock is up 2.8%, while the KRX, which is KBW's Regional Bank Index, is down 12.2%.
We closed FirstBank Lubbock Bancshares, Inc. during the second quarter and completed the system conversion in mid-August. This is the first full quarter of financial reporting for FirstBank & Trust, and they are currently one of Heartland's best-performing banks with the return on average tangible equity of nearly 21%.
The merger and acquisition market is very active, extremely competitive and pricey. We remain disciplined with respect to our financial performance metrics as we model and price prospective M&A transactions. As a result, we are coming in second on a number of deals.
Now that said, our pipeline is extremely deep. And I would hope to announce at least one more acquisition yet this year. As I have said in the past, our priority is to expand in our current footprint and toward our goal of $1 billion in assets in each state where we operate.
At our regular quarterly board meeting on October 16, the board approved a quarterly cash dividend of $0.14 on the company's common stock, payable on November 30 to stockholders of record at the close of business on November 16, 2018. As I shared with you in the past, we've always had an increasing or level dividend.
I'll no turn the call over to Bruce Lee, Heartland's President and CEO, who will provide an overview on our business performance. Bruce?"
Bruce Lee,0,"Thank you, Lynn. At our [ph] 11th Bank in our Heartland Operation Center, we are delivering on our promise to reach new heights in 2018. Third quarter results include a full quarter of results from our newest bank charter, FirstBank & Trust, headquarters in Lubbock, Texas.
In August, we successfully completed the core systems conversion, and the teams are working closely with our clients to retain and grow our relationships through delivery of enhanced service offerings made possible by the merger.
During the third quarter, we continued our focus on organic growth, and we reached new heights and delivered strong 3% annualized in demand deposits. And Heartland continues to retain an enviable mix, with noninterest bearing deposits making up 36% of our deposit and non-time deposits at 88% of total deposits. We are growing deposits and executing a disciplined pricing approach, and we are building deeper relationships across our commercial and consumer clients.
Our Midwestern banks had strong organic loan growth, delivering $39 million for the quarter. Curtis Chrystal and his team at Wisconsin Bank & Trust had an outstanding quarter and delivered more than two thirds of our Midwestern organic loan growth. Our California team at Premier Valley Bank also had a strong quarter, delivering over $12 million in organic loan growth.
5 of our bank charters delivered organic loan growth. However, a few scheduled CRE and construction payoffs and the sale of a company, which ended a long-standing commercial relationship, negatively impacted our organic growth.
Our bankers have full pipelines and our production levels are strong. I have spent more time in the field with our banks and with our customers in the past quarter than I have in my office. I am encouraged by the optimism I hear from our clients. Whether I'm talking with a manufacturer in the Midwest or a commercial real estate developer in the West or a restaurant tour in Southwest, they are all focused on growth. Our customers are predicting continued confidence for the next 6 to 12 months.
When I talk about growth with our clients, I am not hearing significant concerns about new tariffs or other political issues. But a common topic that we discuss is attracting and retaining talent in a near zero unemployment marketplace and the corresponding wage pressure. Our clients are sharing that they feel a deep partnership with our bankers and believe they are positioned to navigate the current market conditions.
Our cards business continues to make great progress, with 49% annual purchasing card volume growth in 2017. Our commercial card payment solutions group was recognized as a top U.S. commercial payment card issuer for the third year in a row. Nicole Tipton and her card solutions group have reached new heights and are now ranked in the top 30 in the nation by the Nielsen report year-over-year.
Our card program has delivered $1 million or 58% in revenue growth over the third quarter of 2017, and they are poised for additional growth in the fourth quarter and beyond.
Moving to mortgage. PrimeWest Mortgage, our new mortgage company that was acquired with FirstBank & Trust, delivered strong results in the third quarter. During the fourth quarter, we expect seasonal decline and continued retooling of our legacy mortgage business.
In our retail business, we have a continuous and comprehensive effort to optimize our branch network. In the third quarter, we closed three branches, one in Arizona, one in Montana and one at Dubuque Bank and Trust. In October, we also announced that Morrill & Janes Bank will close its Dallas branch in January with clients being transitioned to FirstBank & Trust.
We are also seeing opportunities to capitalize on the favorable market for deposits, which led to our recently announced sale of two of our branches at Wisconsin Bank & Trust, that will close in early 2019. This sale is pending regulatory approval.
These branch changes will bring our total number of branches to 119 by early 2019. The branch closings and sales will result in cost reductions and will contribute to improved efficiency. We will continually optimize our branch network and invest in technology enhancements to respond to our client’s preferences for delivery service.
We continue to focus on efficiency, and we have made progress. Our efficiency ratio for the third quarter was 62.4%, down from 64.5% in linked-quarter. Our improvements can be tied to our core deposit growth, maintaining our pricing discipline, delivering synergies from our acquisitions and optimizing our branch network.
Overall, we are pleased with the quarter's revenue and operating performance, and feel we have significant momentum to deliver continued positive results.
Next, I will highlight the key credit metrics for Heartland. Although, Heartland experienced a modest increase in nonperforming assets during the quarter, overall credit quality remains stable.
Nonperforming assets were $85.6 million, 76 basis points of total assets at September 30, compared to $81 million or 72 basis points at June 30. Non-pass-rated loans increased from 5.7% to 6.3% of total loans in the third quarter, but continued to compare favorably to the levels over the past several years.
The delinquency ratio was 62 basis points at quarter end, which is somewhat elevated from recent quarters. When delinquencies from the recently acquired portfolios are excluded from the ratio, it decreases to a level of 34 basis points, which is more consistent with previous quarter.
I would note that we did not see any apparent credit quality issues with the delinquent credits in the acquired portfolio. These delinquencies are primarily attributable to the ongoing transition of our recent acquisitions to Heartland's underwriting and closing processes.
With that, I will now turn the call over to Bryan McKeag for a more detailed - for more detail on our quarterly financial results."
Bryan McKeag,0,"Thanks, Bruce and good afternoon. As Lynn and Bruce have both described, we continue to make progress on a lot of fronts. So I'll try to add some more color and detail to their comments, starting with some positive trends in several key ratios.
First the net interest margin on a tax equivalent basis increased to 4.38%, which is up 8 basis points from last quarter. Loan yields increased 17 basis points during the quarter, investment yields also increased 11 basis points. And interest costs on deposits and borrowings increased by 8 basis points compared to last quarter.
This quarter, the net interest margin includes 25 basis points of purchase accounting accretion compared to 17 basis points in the prior quarter. Second, Heartland's loan-to-deposit ratio was just over 77%. With investments at about 22% of assets, generating $32 million of cash flow per month and total short-term and other borrowings of only $409 million or 3.6% of assets, our liquidity position remains in great shape.
Next, the efficiency ratio was 62.4% for the quarter, down over 260 basis points from last quarter. Excluding M&A-related costs, the efficiency ratio for the quarter would have been 61.2% or 121 basis lower than reported.
Year-to-date, the ratio is right at 65%, which is down 155 basis points compared to last year, and we expect the ratio will remain well below 65% next quarter.
Lastly, the tangible common equity ratio increased 24 basis points to 7.7%. Retained earnings this quarter added 28 basis points, which was partially offset by the reduction in market value of our investments and derivatives, which reduced the ratio by 4 basis points. We expect this ratio will be approaching the 8% mark by year-end. Bruce has already commented on loans and deposits. So I will only comment on a couple of other balance sheet items.
First, investments available-for-sale increased $77 million while investments held to maturity declined $4 million during the quarter. The total investment portfolio ended the quarter at just over $2.5 billion. The tax equivalent yield on the portfolio increased to 2.99%, and the duration for the available-for-sale portfolio remained at about 4 years.
Second, the allowance for loan losses, which as a percentage of loans increased 1 basis point for the quarter to 0.83% of loans. As mentioned in previous quarters, just under $1.9 billion of loans from our most frequent - recent acquisitions are covered by valuation and PCI reserves, totaling $47.1 million or about 2.5%. Excluding these loans from total loans would result in an allowance to loans ratio of 1.09% as of September 30, 2018, which is 4 basis points lower than last quarter.
Moving to the income statement. Net interest income totaled $110.7 million this quarter, up $9.3 million from the prior quarter. The increase was primarily driven by 1 additional day in the quarter, which increased net interest income by about $1.1 million, another $8.1 million was added from a full quarter of FirstBank & Trust.
Noninterest income totaled $29.8 million for the quarter, up $2.2 million from last quarter. When compared to last quarter, gain on sales loans was up 60 - 600,000 with $1.7 million added from a full quarter of PrimeWest Mortgage, offset by $1.1 million reduction in Heartland's legacy mortgage operation.
Service charges were up 800,000 over the last quarter, which is the result of a full quarter of FirstBank & Trust. All other categories in the noninterest income area were relatively flat compared to last quarter.
Moving on to noninterest expense. Total noninterest expense was $92.5 million this quarter, an increase of $33.6 million over the last quarter. This quarter, M&A and system conversion related costs were approximately $1.7 million compared to $1.8 million last quarter.
Core run rate costs, that is excluding M&A cost and asset gains or losses was $90 million compared to $86 million in core costs last quarter, or a $4 million increase. The increase is result of a full quarter of FirstBank & Trust, which increased core cost by approximately $5.4 million. Excluding this increase, the remaining legacy core costs declined by $1.4 million.
By category, the most significant changes were in salary and benefits, professional fees and other expenses. More specifically, salary and benefits decreased $1 million compared to last quarter. In this category, a $2.6 million increase attributable to a full quarter FirstBank & Trust was offset by a reduction in the company-wide healthcare self-insurance accrual, as well as lower salaries, commissions and benefit plan accruals for the legacy mortgage operation.
Professional fees were up $1.8 million, of which 800,000 of the increase is attributable to a full quarter of FirstBank & Trust. The remaining increase is primarily related to the outsourcing costs or restructuring the legacy mortgage origination process, which began this quarter.
And finally, other expenses were up $1.9 million, with 400,000 attributable to higher conversion-related travel costs, 700,000 attributed to a full quarter of FirstBank & Trust, and 340,000 for an investment in a solar tax credit this quarter.
The reported tax - effective tax rate for the quarter was down slightly to 20.99% compared to 21.09% last quarter, as this quarter included the benefit of the previously mentioned solar tax credit. We believe that a normalized tax rate of 21% to 22% is reasonable going forward.
To complete my comments, I'll quickly summarize our outlook for Heartland for the rest of 2018. Starting with loan and deposit growth, which has been volatile and difficult to predict, but should return to the low to mid single digits on an annualized percentage basis.
Net interest margin on a tax equivalent basis should be in the 4.3% to 4.35% range as we expect lower purchase accounting accretion and some continuing pressure on deposit pricing.
Provision for loan losses is expected to be in the range of $45 million per quarter. Mortgage production is expected to slow next quarter, reflecting both a normal fourth quarter seasonal decline and the continued retooling of our legacy mortgage operation.
Core fee income, that is excluding mortgage and security gains and losses, is expected to show high single digit annualized increases from current run rates as we continue to have strong corporate credit card growth and sell into our newly acquired customer bases. And finally, core expenses, that is excluding M&A and other asset gains and losses, is expected to remain relatively flat next quarter in the plus or minus $90 million.
And with that, I'll turn the call over to Lynn."
Lynn Fuller,0,"Thank you, Bryan. We'll now open the phone lines for questions from our analysts."
Operator,1,Thank you. [Operator Instructions] Our first question comes from the line of Jeff Rulis from D.A. Davidson. Please proceed with your question.
Jeff Rulis,1,"Thanks. Good afternoon. A question on the - Bruce, you talked about some of the payoff activity. I was wondering if you had that relative to 2Q. So quarterly payoff numbers linked-quarter?"
Bruce Lee,1,"I don't have the specific payoff numbers linked-quarter. But what we did see is a lot more payoffs in the real estate space. And we were actually out in Colorado last week. And one of the comments made out there was that sort of the smart money, if you will, is taking advantage of low cap rates and higher prices, and they are actually selling a lot of the real estate.
Now we were aware of this was happening. So we -- it was scheduled, but we're seeing that in our Western markets almost across the board, and the real estate investors and developers that I have talked to in the quarter said that, that was part of their overall strategy right now with where the values were on real estate."
Jeff Rulis,1,"Got it. So linked-quarter, you think that was up, if you think about second quarter not specific numbers but it felt like more..."
Bruce Lee,1,It accelerated during the third quarter.
Jeff Rulis,1,Okay. Got it. And then any early indication as we're into Q4 now? Is that ebbed at all or feels like that still going on?
Bruce Lee,1,"It is - we haven't seen it so far this quarter. And in the projections that our banks are providing for what they believe their growth will be, we're not seeing the same significant amount of payoffs on finished projects. We have a few construction loans that we - that we'll complete and payoff. But we're not seeing anything like we saw so far in the third quarter."
Jeff Rulis,1,Got it. So that was in line with your guidance on the loan growth to presume low- to mid-single digit?
Bruce Lee,1,Yes. It would.
Bryan McKeag,1,"Okay. I would say barring any surprises between now and year-end, because they have been coming up."
Jeff Rulis,1,"Yes. No, tough to gauge. And then maybe one, I don't know maybe for Bryan. I just wanted to clarify on the Durbin expectation, the fee income hit next -- through third quarter. I wanted to make sure I have that number. What is that on an annual basis?"
Bryan McKeag,1,"Yes. I think right now I would say we're still in the $6 million range, that - we're $11.3 billion. We get up to 12 mid-next year, which kicks in, in July of next year. It could been a bit higher than that. And then - so that's an annualized number. So next year, you'll get half of that in the last half of the year. That's pretax."
Jeff Rulis,1,"Okay. All right, thanks. I’ll step back."
Operator,1,Our next question comes from the line of Nathan Race from Piper Jaffray. Please proceed with your question.
Nathan Race,1,"Hey, guys."
Bruce Lee,1,"Hi, Nathan."
Nathan Race,1,"Bryan, just wanted to start on the core margin outlook. I mean if I exclude the purchase accounting accretion, it looks like it held in kind of flat at around 4.30% in the quarter. Deposit costs, continue to be fairly well behaved up, 6 bps sequentially. So just curious if you guys think we can continue to hold on the deposit cost to a similar magnitude so - to what we saw this quarter? And just kind of curious what loan rate you're putting new product on the books relative to kind of your core portfolio yield around 5.30% or so?"
Bryan McKeag,1,"Yes. So a couple of things. I think this quarter, we probably saw a beta of about 30. We tend to model 40. So we're doing better than what our normal model is. It's actually a little bit better this quarter than last quarter in terms of the beta. Now overall, in the last year, it's been in that 25% or beta-25.
So I think it's probably going to continue around that 30 to 40 depending upon competition. We're really trying to not lead competition, but we're trying to stay with competition and make sure we're in there..."
Bruce Lee,1,So that we can continue to grow our non-time deposit book.
Bryan McKeag,1,"And then in terms of current pricing, I went back and looked in September, our new and renewed, we're somewhere in the 4.25% to -- 5.25% to 5.50% range. Pricing is a little bit better out west than it is here in the Midwest."
Nathan Race,1,"Okay. Got you. So kind of bringing all those pieces together, maybe fair to expect the margins to continue to drip maybe a basis point or 2 higher the September rate hike that have recently..."
Bryan McKeag,1,"Yes. I think -- yes. I think so. And the way I was thinking of it. We kind of had 8 more basis points of accretion. If you take that 8 basis point down, you are in the 4.30% range. But I think with this rate hike, typically if we get our full beta, which is that 40, we should add 1 to maybe 2 basis points on the margin, depending upon how things break one way or the other. So I think you're thinking of it about right."
Nathan Race,1,"Okay. Great. That's good color. And then just kind of thinking about expenses. The next few quarters, I appreciate your near-term guidance to hold around to kind of 90 or so. Just curious, as we look into next year, obviously you guys are still going to be investing in the business and looking to bring in some more commercial hires, as I imagine and so forth.
But is there any potential relief on the FDIC insurance assessment just given where that front stands that you guys are perhaps baking into the outlook for 2019?"
Bryan McKeag,1,"We haven't factored that in yet, Nate. That'll be great if there was some relief. But I don't know that - I've heard enough to start factoring that in yet."
Nathan Race,1,"Got you. And then just lastly, any color on the increase in non-performers on this linked-quarter basis. I think they're just a little bit, but I am just curious, what you guys are seeing in terms of areas of weakness and so forth?"
Bruce Lee,1,"Drew Townsend, our Chief Credit Officer has joined. I'll let Drew, maybe touch on that, Nate."
Andrew Townsend,1,"Thank you. It was rather granular, will be the way I describe it, Nate. We had 1 larger relationship and FirstBank and Lubbock that was a well-publicized national event in a foreplan relationship that by itself accounted for $3-plus million. The balance was smaller, kind of scattered throughout the footprint and not necessarily focused in any one particular industry."
Nathan Race,1,"Okay. Great. And, Drew, well, I have you. Just broadly, in terms of criticized classified trends in the quarter, any thoughts on kind of what you're seeing stable to down, I guess, sequentially?"
Andrew Townsend,1,"Yes. Again, the subcategory ticked up a little bit largely by the increase. We try to track the million-dollar or larger relationships in the buckets for this exercise in particular. And we did grow, again, by a small handful of those. Watch was also elevated just a bit.
There was one larger relationship that, I don't think, long-term has any negative repercussions but is working through some kind of management succession challenges in 2018. So I think there's a strong likelihood that, that relationship could actually turn back the right way in 2019."
Nathan Race,1,"Okay. Thank you, guys. I appreciate all the color."
Bruce Lee,1,Thank you.
Operator,1,Our next question comes from the line of Andrew Liesch from Sandler O'Neill. Please proceed with your question.
Andrew Liesch,1,"Hi, everyone."
Bruce Lee,1,"Hi, Andrew."
