speaker,q&a,content
Paul Isabella,1,"Yeah. Well, there's a couple of pieces, one, the 40 branches just allude to the synergy work and its consolidation because if you have a branch a half mile away and everything lines up. Of course, we are going to take the opportunity consolidate that's what we have done.
Beyond that it's just especially now with us having so many dense markets, so many dense MSAs with multiple branches, we need to continue our work to maximize shipments use of branch personnel all those things, which we have begun some of that is baked into our synergy target within the 120.
We think there's additional opportunity as we go through these next few years, so we are just really targeting. Again, it's a separate from the branch consolidations targeting our MSA is where we have multiple locations much like Allied is done to drive efficiencies within our network fuel, freight, inventory, et cetera."
Tim Mazurczak,1,"Okay. Then just one quick follow up, you said about $1 billion in business will come from e-commerce in the next few years."
Paul Isabella,1,Yeah.
Tim Mazurczak,1,Are any -- is any of that revenue coming from the rationalization of networks are someone going from in-store to more e-commerce or now?
Paul Isabella,1,"Yeah. The assumptions that I make, when I say billion dollars is you know we are in pretty good shape in terms of where we are exiting the year and whether it's three years to five years, that's that billion dollar target, a lot of that will be cannibalization. I mean there's a there's a piece of that that will be new, because we will attract new customers. Again, it's not an exact number but right now we are targeting 10% to 15% new, potentially some of that could come from that.
But we know as we roll have rolled this out and we really just went through our first fiscal year with the e-commerce platform and still continuing, as I mentioned, in my prepared remarks, continuing to add functionality that it's going to grow customers like it. It helps them do their jobs better. We know that we will take existing product are orders that are going through our regular process convert them to e-commerce and then we will naturally grow additional customers as we go through time."
Operator,1,Thank you and that concludes the questions. Now like to turn the call back over to Mr. Isabella for closing comments.
Paul Isabella,1,"Thanks, Justin. Just briefly thanks again for everyone participating in today's call. We appreciate the interest from investors, customers, suppliers and our employees. And as a reminder, our second Investor Day will be in New York City on December 13th, and this event will also be webcast. We wish all of you and your families a Happy Thanksgiving. Have a good rest of evening. Thanks."
Operator,1,Thank you and this concludes today's call. Everyone may disconnect.
